{
  "clip_id": "fixture_heldout_glute_01",
  "exercise": "glute_bridge",
  "target_person_id": "synthetic-user-04",
  "annotation_version": "v1.0",
  "visibility_segments": [
    {
      "start_time": 0.0,
      "end_time": 24.0,
      "state": "FULL",
      "reason": "OK"
    }
  ],
  "distractor_events": [],
  "repetitions": [
    {
      "repetition_index": 1,
      "start_time": 2.0,
      "inflection_time": 4.0,
      "end_time": 6.0,
      "valid": true,
      "form_flags": []
    },
    {
      "repetition_index": 2,
      "start_time": 7.0,
      "inflection_time": 9.0,
      "end_time": 11.0,
      "valid": true,
      "form_flags": []
    },
    {
      "repetition_index": 3,
      "start_time": 12.0,
      "inflection_time": 14.0,
      "end_time": 16.0,
      "valid": true,
      "form_flags": []
    }
  ]
}
