{
  "clip_id": "fixture_heldout_squat_01",
  "exercise": "bodyweight_squat",
  "target_person_id": "synthetic-user-03",
  "annotation_version": "v1.0",
  "visibility_segments": [
    {
      "start_time": 0.0,
      "end_time": 18.0,
      "state": "FULL",
      "reason": "OK"
    }
  ],
  "distractor_events": [
    {
      "start_time": 0.0,
      "end_time": 18.0,
      "type": "stationary_bystander"
    }
  ],
  "repetitions": [
    {
      "repetition_index": 1,
      "start_time": 1.0,
      "inflection_time": 3.0,
      "end_time": 5.0,
      "valid": true,
      "form_flags": []
    },
    {
      "repetition_index": 2,
      "start_time": 5.5,
      "inflection_time": 7.5,
      "end_time": 9.5,
      "valid": true,
      "form_flags": []
    },
    {
      "repetition_index": 3,
      "start_time": 10.0,
      "inflection_time": 12.0,
      "end_time": 14.0,
      "valid": true,
      "form_flags": []
    }
  ]
}
